pr_id,pr_url,issue_id,issue_url,non_test_code_changes,agent_result,agent_comment
380,https://github.com/alibaba/spring-ai-alibaba/pull/380,15,https://github.com/alibaba/spring-ai-alibaba/issues/15,279,Bad PR,The issue lacks clarity and specificity about the exact error in the 'hello-examples' documentation. The description is vague and does not provide enough actionable detail for a developer to understand what needs to be fixed or improved.
1152,https://github.com/alibaba/spring-ai-alibaba/pull/1152,15,https://github.com/alibaba/spring-ai-alibaba/issues/15,312,Bad PR,"The issue is vague and lacks clear, actionable information. It doesn't explain what the error is or what the expected behavior should be, making it difficult for a developer to start work. Additionally, the issue does not provide enough context or detail about the problem to focus on a single well-defined issue."
1244,https://github.com/alibaba/spring-ai-alibaba/pull/1244,15,https://github.com/alibaba/spring-ai-alibaba/issues/15,105,Bad PR,"The issue does not clearly describe the problem with 'hello-examples', lacks actionable steps to reproduce the bug, and is vague regarding what the error is. It does not provide enough context for a developer to start working on a solution."
1236,https://github.com/alibaba/spring-ai-alibaba/pull/1236,15,https://github.com/alibaba/spring-ai-alibaba/issues/15,555,Bad PR,"The issue lacks clarity and actionable detail, as it does not explain what the error is with the 'hello-examples' document or how it affects functionality. The description is vague and does not provide enough context for a developer to start working on it."
1221,https://github.com/alibaba/spring-ai-alibaba/pull/1221,15,https://github.com/alibaba/spring-ai-alibaba/issues/15,125,Bad PR,"The issue body does not provide a clear and actionable description of the problem. It mentions an error but does not specify what the error is or how it affects the functionality. Additionally, the provided URL is unclear and lacks context, making it difficult for a developer to act on this issue. It also doesn't clearly identify a single well-defined problem or feature request."
1215,https://github.com/alibaba/spring-ai-alibaba/pull/1215,15,https://github.com/alibaba/spring-ai-alibaba/issues/15,1571,Bad PR,"The issue lacks clarity and specificity. It does not clearly describe the problem encountered with the 'hello-examples' component, and it provides an unclear URL with a query that has a potential formatting issue. Additionally, it does not address a well-defined problem or feature request, making it difficult for a developer to take actionable steps."
1132,https://github.com/alibaba/spring-ai-alibaba/pull/1132,849,https://github.com/alibaba/spring-ai-alibaba/issues/849,525,Good PR,"The issue is clear and actionable, outlining specific changes needed for the tool-call modules with detailed instructions. It focuses on optimizing and refactoring existing modules, addresses a single well-defined problem, and provides context for the developer to get started. It does not request a revert, ask vague questions, or make general requests for help. Additionally, the majority of the content is in English."
1191,https://github.com/alibaba/spring-ai-alibaba/pull/1191,15,https://github.com/alibaba/spring-ai-alibaba/issues/15,46,Bad PR,"The issue description is vague and lacks sufficient detail about the specific error in the document related to 'hello-examples'. It doesn't provide actionable steps for a developer to resolve the problem or reproduce it effectively, making it unsuitable for a 'Good PR'. Additionally, the URL provided is not clearly explained in context."
1179,https://github.com/alibaba/spring-ai-alibaba/pull/1179,15,https://github.com/alibaba/spring-ai-alibaba/issues/15,239,Bad PR,"The issue lacks specificity and clarity regarding the nature of the error in the documentation. It presents a vague statement about an error without providing enough context or details on how to reproduce or address the problem, making it difficult for a developer to start working on it."
1111,https://github.com/alibaba/spring-ai-alibaba/pull/1111,15,https://github.com/alibaba/spring-ai-alibaba/issues/15,633,Bad PR,"The issue is vague and lacks enough context to describe a specific actionable problem. It does not provide clear steps to reproduce the error or the expected behavior, and the description contains incomplete information (e.g., 'input=?'). Additionally, it does not focus on a single well-defined problem or feature request."
1041,https://github.com/alibaba/spring-ai-alibaba/pull/1041,15,https://github.com/alibaba/spring-ai-alibaba/issues/15,1001,Bad PR,"The issue is too vague and does not provide clear context or actionable steps for a developer to address the reported error. It lacks detailed information about the nature of the error, and the description provided is unclear. Additionally, it does not focus on a single, well-defined problem."
905,https://github.com/alibaba/spring-ai-alibaba/pull/905,15,https://github.com/alibaba/spring-ai-alibaba/issues/15,429,Bad PR,"The issue describes a bug, but it lacks clarity and actionable information. It does not specify what the actual error is with the 'hello-examples' document or what the expected behavior should be. Additionally, it appears to be a vague report rather than a well-defined problem, and there's no clear focus on a single issue."
1007,https://github.com/alibaba/spring-ai-alibaba/pull/1007,15,https://github.com/alibaba/spring-ai-alibaba/issues/15,396,Bad PR,"The issue description is vague and lacks clarity on the specific problem or feature being addressed. It does not provide enough context for a developer to understand what the actual error is and how to resolve it. Additionally, the use of 'error about using hello-examples' is unclear and does not describe a well-defined issue."
988,https://github.com/alibaba/spring-ai-alibaba/pull/988,15,https://github.com/alibaba/spring-ai-alibaba/issues/15,215,Bad PR,"The issue lacks a clear and actionable description of the problem. It's vague and does not provide sufficient context for a developer to start working on it. Additionally, it appears to be a vague bug report without detailed information about the expected behavior or reproduce steps."
925,https://github.com/alibaba/spring-ai-alibaba/pull/925,15,https://github.com/alibaba/spring-ai-alibaba/issues/15,88,Bad PR,"The issue lacks clarity and actionable details. It does not specify what the error in the document is or how it affects usage. Additionally, it does not provide enough context for a developer to resolve the problem effectively."
912,https://github.com/alibaba/spring-ai-alibaba/pull/912,15,https://github.com/alibaba/spring-ai-alibaba/issues/15,77,Bad PR,"The issue does not clearly describe a specific, actionable problem or feature, as it only mentions an error without explaining what the expected behavior is or how to reproduce the issue. It lacks sufficient context and detail for a developer to start working on it."
899,https://github.com/alibaba/spring-ai-alibaba/pull/899,15,https://github.com/alibaba/spring-ai-alibaba/issues/15,245,Bad PR,"The issue lacks clarity and actionable details, providing vague information about an error without a clear description of the problem. It does not specify the nature of the error or what is expected versus what is encountered, making it difficult for a developer to address it effectively."
866,https://github.com/alibaba/spring-ai-alibaba/pull/866,15,https://github.com/alibaba/spring-ai-alibaba/issues/15,750,Bad PR,"The issue is vague and lacks clear actionable steps. It only mentions an error about using 'hello-examples' without specifying what the actual error is or what the intended behavior should be. Additionally, it does not focus on a single, well-defined problem and does not provide enough context for a developer to start working."
804,https://github.com/alibaba/spring-ai-alibaba/pull/804,15,https://github.com/alibaba/spring-ai-alibaba/issues/15,766,Bad PR,"The issue is vague and lacks sufficient detail about the specific error in the documentation. It does not provide clear actionable steps for a developer to address it, and it appears to be focusing on a single issue but without enough context or clarity."
824,https://github.com/alibaba/spring-ai-alibaba/pull/824,15,https://github.com/alibaba/spring-ai-alibaba/issues/15,50,Bad PR,"The issue does not provide enough context or detailed information about the problem with 'hello-examples'. It mentions an error but does not explain what the error is or how it should be addressed. Additionally, the description is vague and lacks actionable items for a developer to work on, failing the 'Clear and Actionable' and 'Single Issue Focus' criteria."
771,https://github.com/alibaba/spring-ai-alibaba/pull/771,15,https://github.com/alibaba/spring-ai-alibaba/issues/15,49,Bad PR,"The issue is vague and lacks sufficient detail for a developer to take actionable steps. It does not clearly describe the specific problem or how the 'error' manifests, nor does it provide adequate context for addressing it. Additionally, the content includes unclear URL parameters, contributing to its ambiguity."
516,https://github.com/alibaba/spring-ai-alibaba/pull/516,15,https://github.com/alibaba/spring-ai-alibaba/issues/15,413,Bad PR,"The issue is too vague and lacks clear, actionable information about what the specific problem is with 'hello-examples'. It also appears to be primarily a bug report but does not provide enough detail for a developer to address the issue effectively."
535,https://github.com/alibaba/spring-ai-alibaba/pull/535,15,https://github.com/alibaba/spring-ai-alibaba/issues/15,70,Bad PR,"The issue lacks clarity and actionable details. It mentions an error but does not specify what the error is or how it can be reproduced. The URL provided does not clarify the problem, making it difficult for a developer to address. Additionally, it does not focus on a single well-defined problem or feature request."
451,https://github.com/alibaba/spring-ai-alibaba/pull/451,15,https://github.com/alibaba/spring-ai-alibaba/issues/15,34,Bad PR,"The issue lacks clear details about the specific error with the link provided. It does not describe what the error is or what the expected behavior should be, making it vague and difficult for a developer to take actionable steps. Additionally, it does not focus on a single issue but rather hints at a problem without providing context."
445,https://github.com/alibaba/spring-ai-alibaba/pull/445,15,https://github.com/alibaba/spring-ai-alibaba/issues/15,145,Bad PR,"The issue lacks a clear and actionable description of the problem. It doesn't specify what the error is with 'hello-examples', and the URL provided is not informative. Additionally, the issue is not framed in a way that allows a developer to start working on a fix, and it doesn't clearly outline a single well-defined problem."
423,https://github.com/alibaba/spring-ai-alibaba/pull/423,15,https://github.com/alibaba/spring-ai-alibaba/issues/15,48,Bad PR,"The issue lacks clarity and actionable detail, does not describe a specific problem or enhancement, and does not provide sufficient context for a developer to address the issue. Additionally, the issue is quite vague regarding the nature of the error or the expected behavior, and it appears to focus on an unclear problem without a concrete example or sufficient explanation."
398,https://github.com/alibaba/spring-ai-alibaba/pull/398,15,https://github.com/alibaba/spring-ai-alibaba/issues/15,1536,Bad PR,"The issue does not clearly describe a specific problem or actionable feature. It mentions an error but lacks detailed context on what the error is or how it can be reproduced. Additionally, it does not address a single defined issue with sufficient clarity, making it vague and ambiguous."
369,https://github.com/alibaba/spring-ai-alibaba/pull/369,279,https://github.com/alibaba/spring-ai-alibaba/issues/279,853,Bad PR,"The issue body does not present a specific problem or feature request; it instead includes instructions about language use and formatting for submitting issues. It lacks a clear and actionable problem description, making it unsuitable for a 'Good PR'. Additionally, a significant portion of the text is in Chinese, which does not meet the requirement of being primarily in English."
220,https://github.com/alibaba/spring-ai-alibaba/pull/220,199,https://github.com/alibaba/spring-ai-alibaba/issues/199,102,Bad PR,"The issue is vague and includes a question about preventing an exception, which makes it not actionable. It does not clearly define a specific problem or feature request that a developer can address, and it includes multiple concerns rather than focusing on a single issue."
222,https://github.com/alibaba/spring-ai-alibaba/pull/222,225,https://github.com/alibaba/spring-ai-alibaba/issues/225,299,Bad PR,Issue body is too short.
120,https://github.com/alibaba/spring-ai-alibaba/pull/120,15,https://github.com/alibaba/spring-ai-alibaba/issues/15,662,Bad PR,"The issue does not provide a clear and actionable description of the problem, as it lacks sufficient context and specific details. Additionally, the description is vague and does not indicate what the actual error is or how it affects the functionality. It appears to be a simple observation rather than a well-defined feature request or bug report."
110,https://github.com/alibaba/spring-ai-alibaba/pull/110,15,https://github.com/alibaba/spring-ai-alibaba/issues/15,48,Bad PR,"The issue is vague and does not clearly describe the specific problem or the expected behavior. It lacks sufficient detail and context for a developer to take actionable steps, and the description does not outline a well-defined problem or feature request, making it unsuitable for a 'Good PR'."
