pr_id,pr_url,issue_id,issue_url,non_test_code_changes,agent_result,agent_comment
17887,https://github.com/crate/crate/pull/17887,17518,https://github.com/crate/crate/issues/17518,97,Good PR,"The issue is clear and actionable, outlining specific tasks related to the migration to `schemas/RelationMetadata`. It does not request a revert, does not pose a question, and maintains focus on a single, well-defined feature request. The content is primarily in English and provides sufficient details for a developer to commence work on the tasks listed."
17880,https://github.com/crate/crate/pull/17880,17518,https://github.com/crate/crate/issues/17518,48,Good PR,"The issue describes a specific migration task that outlines several actionable steps and requirements, providing adequate context for a developer to start working on it. It is focused on a single problem (migration to `schemas/RelationMetadata`) and avoids being a revert, question, or vague request. The content is primarily in English and adheres to the necessary criteria for a 'Good PR'."
17727,https://github.com/crate/crate/pull/17727,17666,https://github.com/crate/crate/issues/17666,462,Good PR,"The issue describes a clear and actionable problem, specifying a change to be made with a tangible outcome. It identifies multiple classes that need to be addressed and outlines the relationship between the current implementation and the proposed changes. It is focused on a single, well-defined task and is primarily written in English, meeting the criteria for a Good PR."
17723,https://github.com/crate/crate/pull/17723,17666,https://github.com/crate/crate/issues/17666,354,Good PR,"The issue provides a clear and actionable description of a problem, specifying the need to replace the IndicesRequest interface with a RelationName and detailing the relevant implementing classes. It focuses on a specific enhancement, does not involve reverting any changes, and is primarily written in English."
17627,https://github.com/crate/crate/pull/17627,17518,https://github.com/crate/crate/issues/17518,414,Good PR,"The issue provides a clear and actionable plan for completing the migration to schemas/RelationMetadata, detailing specific tasks and logical steps necessary to achieve the goal. It does not request any reverts, asks vague questions, or lack focus, and is primarily written in English. The outlined tasks are delineated, making it straightforward for a developer to engage with the problem."
17549,https://github.com/crate/crate/pull/17549,17344,https://github.com/crate/crate/issues/17344,614,Bad PR,"The issue lists multiple tasks related to upgrading dependencies and handling deprecations but fails to define a single, clear, and actionable problem or feature. It seems to encompass multiple changes without focusing on a specific, well-defined issue, which does not meet the 'Single Issue Focus' criterion."
17548,https://github.com/crate/crate/pull/17548,17410,https://github.com/crate/crate/issues/17410,133,Bad PR,Issue body is too short.
