pr_id,pr_url,issue_id,issue_url,non_test_code_changes,agent_result,agent_comment
14065,https://github.com/open-telemetry/opentelemetry-java-instrumentation/pull/14065,13468,https://github.com/open-telemetry/opentelemetry-java-instrumentation/issues/13468,991,Good PR,"The issue clearly identifies a specific problem regarding the lack of consistent and comprehensive documentation for Java instrumentation projects. It provides actionable solutions, including a structured metadata system to automate documentation, and outlines what metadata should be tracked. Additionally, the issue is focused, primarily written in English, and is not a request to revert changes or a vague query. Overall, it meets all the criteria for a 'Good PR.'"
14018,https://github.com/open-telemetry/opentelemetry-java-instrumentation/pull/14018,13468,https://github.com/open-telemetry/opentelemetry-java-instrumentation/issues/13468,221,Good PR,"The issue provides a clear and actionable description of a problem related to documentation of Java instrumentations, specifying the need for improved metadata management. It outlines a concrete solution with a detailed list of proposed metadata fields and ideas for implementation. The request does not involve reverting changes, asking questions, or being vague, and it focuses on a single well-defined feature. The content is primarily in English, meeting the required criteria."
13719,https://github.com/open-telemetry/opentelemetry-java-instrumentation/pull/13719,7413,https://github.com/open-telemetry/opentelemetry-java-instrumentation/issues/7413,447,Good PR,"The issue presents a clear and actionable feature request for resolving bind variables in recorded SQL statements. It articulates specific benefits, discusses a proposed opt-in solution, addresses possible performance and security concerns, and provides alternatives. The content is focused on a singular, well-defined problem and is primarily written in English, meeting all the criteria for a 'Good PR'."
13968,https://github.com/open-telemetry/opentelemetry-java-instrumentation/pull/13968,13468,https://github.com/open-telemetry/opentelemetry-java-instrumentation/issues/13468,187,Good PR,"The issue is clear and actionable, outlining a specific problem related to the documentation of Java instrumentations and proposing a solution involving the generation of metadata. It does not request a revert, is not a vague question, and focuses on a single well-defined feature request. Additionally, the content is primarily in English, meeting all the criteria for a 'Good PR'."
13796,https://github.com/open-telemetry/opentelemetry-java-instrumentation/pull/13796,13812,https://github.com/open-telemetry/opentelemetry-java-instrumentation/issues/13812,119,Good PR,"The issue describes a specific problem related to JMX rules that requires a unit to be specified. It provides clear reproduction steps, expected behavior, and actual behavior, allowing developers to understand the problem and work on a solution. The issue is not vague, does not request a revert, and focuses on a single well-defined issue."
13733,https://github.com/open-telemetry/opentelemetry-java-instrumentation/pull/13733,13725,https://github.com/open-telemetry/opentelemetry-java-instrumentation/issues/13725,81,Bad PR,"The issue does not clearly outline a specific and actionable problem or feature. While it identifies a lack of instrumentation for avaje-jex, it does not provide enough details about what the instrumentation should entail. Additionally, the presence of a question about interaction with existing instrumentation indicates vagueness, which does not meet the requirement for clarity and focus."
13589,https://github.com/open-telemetry/opentelemetry-java-instrumentation/pull/13589,13461,https://github.com/open-telemetry/opentelemetry-java-instrumentation/issues/13461,103,Good PR,"The issue presents a clear, actionable problem regarding the handling of negative values for certain JVM metrics, explains the context well, and suggests a specific solution with an example YAML configuration. It is focused on a single issue and does not request a revert or pose a vague question. Additionally, it is primarily in English and provides references that support the problem and solution presented."
13531,https://github.com/open-telemetry/opentelemetry-java-instrumentation/pull/13531,13468,https://github.com/open-telemetry/opentelemetry-java-instrumentation/issues/13468,489,Good PR,"The issue presents a clear and actionable feature request to improve the documentation process for Java instrumentation by establishing a standard set of metadata. It details the problem, proposes a concrete solution, and outlines specific metadata and ideas for implementation, making it suitable for a focused and meaningful contribution."
13466,https://github.com/open-telemetry/opentelemetry-java-instrumentation/pull/13466,13444,https://github.com/open-telemetry/opentelemetry-java-instrumentation/issues/13444,202,Good PR,"The issue clearly identifies a specific problem regarding the missing instrumentation for the `RequestStreamHandler` in the OpenTelemetry Java agent. It provides a actionable context by referencing relevant links and code paths, making it suitable for a developer to work on this enhancement. Additionally, it does not request a revert, answer a question, or present a vague request, and it maintains focus on a single issue."
13449,https://github.com/open-telemetry/opentelemetry-java-instrumentation/pull/13449,13468,https://github.com/open-telemetry/opentelemetry-java-instrumentation/issues/13468,553,Good PR,"The issue provides a clear and actionable problem related to improving the documentation for the java instrumentation project by establishing a system for managing and generating metadata. It outlines specific metadata to be included, suggests methods to automate the process, and contains no requests for reversion, vague questions, or off-topic content. The focus is on a well-defined feature request, making it suitable for a 'Good PR'."
13385,https://github.com/open-telemetry/opentelemetry-java-instrumentation/pull/13385,13361,https://github.com/open-telemetry/opentelemetry-java-instrumentation/issues/13361,118,Good PR,"The issue describes a specific, actionable problem related to capturing JVM runtime metrics with declarative YAML, providing a clear context and a detailed solution proposal. It does not request a revert, avoid vague questions, or documentation help, and maintains focus on a single issue of implementing a lowercase function for attribute normalization. Furthermore, it is primarily written in English."
13296,https://github.com/open-telemetry/opentelemetry-java-instrumentation/pull/13296,12846,https://github.com/open-telemetry/opentelemetry-java-instrumentation/issues/12846,250,Bad PR,"The issue body is a tracking issue listing several tasks and does not clearly describe a specific, actionable problem or feature. It contains multiple tasks, making it not focused on a single issue. Additionally, the content is mostly a list rather than a detailed explanation, which does not meet the clarity and specificity criteria for a 'Good PR'."
13243,https://github.com/open-telemetry/opentelemetry-java-instrumentation/pull/13243,13216,https://github.com/open-telemetry/opentelemetry-java-instrumentation/issues/13216,581,Bad PR,"The issue lacks a detailed explanation of the specific problem and clear requirements for the new instrumentation, making it less actionable. It also does not provide any alternatives or concrete examples of how this feature would be implemented or used. Therefore, it doesn't meet the criteria for a 'Good PR'."
12513,https://github.com/open-telemetry/opentelemetry-java-instrumentation/pull/12513,12573,https://github.com/open-telemetry/opentelemetry-java-instrumentation/issues/12573,323,Bad PR,"The issue presents a vague request for help regarding missing log data in Grafana Loki and does not clearly outline a specific, actionable problem to be addressed. It lacks sufficient context for a developer to start working independently, and it reads more like an inquiry than a focused issue to be resolved."
12952,https://github.com/open-telemetry/opentelemetry-java-instrumentation/pull/12952,4596,https://github.com/open-telemetry/opentelemetry-java-instrumentation/issues/4596,251,Good PR,"The issue provides a clear and actionable request to improve consistency in the ByteBuddy instrumentation by adopting a specific pattern. It is not a revert, vague question, or request for documentation but is focused on a single, well-defined change that would also require updating documentation. The content is primarily in English."
12839,https://github.com/open-telemetry/opentelemetry-java-instrumentation/pull/12839,7345,https://github.com/open-telemetry/opentelemetry-java-instrumentation/issues/7345,46,Bad PR,"The issue body lacks clarity and specificity regarding the proposed changes, particularly for the 'view spans' where the author mentions being unsure about what to do. It also contains a vague discussion reference rather than a concrete plan or problem definition. Additionally, the issue includes multiple components under discussion, indicating it's not single issue focused. Therefore, it does not meet the criteria for a 'Good PR'."
12756,https://github.com/open-telemetry/opentelemetry-java-instrumentation/pull/12756,12493,https://github.com/open-telemetry/opentelemetry-java-instrumentation/issues/12493,83,Good PR,"The issue clearly describes a specific problem with the AWS SDK 1.11 requests auto instrumentation not setting the db.system attribute for DynamoDB spans. It provides actionable steps to reproduce the bug and outlines the expected versus actual behavior, making it suitable for a developer to start working on it. The issue does not request a revert, is not vague, focuses on a single problem, and is primarily in English."
12432,https://github.com/open-telemetry/opentelemetry-java-instrumentation/pull/12432,11457,https://github.com/open-telemetry/opentelemetry-java-instrumentation/issues/11457,265,Good PR,"The issue provides a clear and actionable plan for modifying specific instrumentation modules, detailing necessary changes for compliance, while also referencing related PRs for context. It focuses on a single problem (making modules indy compliant) and is primarily written in English, making it suitable for a 'Good PR'."
