pr_id,pr_url,issue_id,issue_url,non_test_code_changes,agent_result,agent_comment
7266,https://github.com/open-telemetry/opentelemetry-java/pull/7266,5187,https://github.com/open-telemetry/opentelemetry-java/issues/5187,292,Good PR,"The issue clearly describes a specific problem related to exception stack trace formatting and provides actionable suggestions for a solution. It is not a revert, a question, or vague. It focuses on a single feature request that is well-defined and primarily written in English."
7332,https://github.com/open-telemetry/opentelemetry-java/pull/7332,7051,https://github.com/open-telemetry/opentelemetry-java/issues/7051,60,Good PR,"The issue provides a clear and actionable request to add specific methods to the SDK, linking to a prior issue for context. It describes a single, well-defined problem by stating what methods need to be implemented, thus meeting all criteria for a 'Good PR'."
7293,https://github.com/open-telemetry/opentelemetry-java/pull/7293,7292,https://github.com/open-telemetry/opentelemetry-java/issues/7292,489,Good PR,"The issue describes a specific, actionable requirement to relocate declarative configuration functionality to a more permanent location, providing clear dependencies and considerations involved in the process. It is focused on a single well-defined problem, not a revert, question, or vague request. Additionally, the majority of the content appears to be written in English."
7264,https://github.com/open-telemetry/opentelemetry-java/pull/7264,4901,https://github.com/open-telemetry/opentelemetry-java/issues/4901,668,Good PR,"The issue clearly describes a specific problem related to spatial reaggregation in Java, providing a concrete example that demonstrates the issue. It does not request a revert, nor is it vague or merely a question. It focuses on a specific, well-defined problem, and the content is primarily in English."
7280,https://github.com/open-telemetry/opentelemetry-java/pull/7280,7276,https://github.com/open-telemetry/opentelemetry-java/issues/7276,61,Good PR,"The issue describes a specific bug related to the `OtlpGrpc/HTTPMetricExporter.toBuilder()` method not retaining the configured temporality. It provides a clear, actionable problem, outlines steps to reproduce the issue with code snippets, and focuses on a single defined problem. Additionally, the description is primarily in English and does not involve reverting changes or asking vague questions."
7152,https://github.com/open-telemetry/opentelemetry-java/pull/7152,6995,https://github.com/open-telemetry/opentelemetry-java/issues/6995,364,Bad PR,"The issue is vague and lacks clear actionable steps for a developer to implement. While it mentions a requirement for functionality related to the OpenTelemetry Java SDK, it does not specify the exact problems or features needed, making it less suitable for a good pull request."
7150,https://github.com/open-telemetry/opentelemetry-java/pull/7150,6241,https://github.com/open-telemetry/opentelemetry-java/issues/6241,112,Good PR,"The issue describes a specific bug related to class loading in an OSGi environment, provides clear steps to reproduce, and specifies the expected and actual outcomes. It focuses on a single, well-defined problem and does not request a revert, a question, or documentation. While the issue is primarily in English, the additional context remains minimal, contributing to its clarity."
7053,https://github.com/open-telemetry/opentelemetry-java/pull/7053,7008,https://github.com/open-telemetry/opentelemetry-java/issues/7008,728,Good PR,"The issue presents a clear and actionable problem related to the event API and SDK's current status. It discusses specific changes, provides context from discussions in a SIG, and outlines concrete options for addressing the situation, making it suitable for a developer to start working on a solution. It is not a revert, a vague request, or a user question, and focuses on a single issue regarding the API changes."
7030,https://github.com/open-telemetry/opentelemetry-java/pull/7030,7024,https://github.com/open-telemetry/opentelemetry-java/issues/7024,20,Good PR,"The issue describes specific misalignments between the implementation and the specification, outlining clear problems (such as incorrect value enforcement for limits) that need to be addressed. It is not a revert, a vague request, or a question, and it focuses on resolving a single issue regarding compliance with the specification."
6944,https://github.com/open-telemetry/opentelemetry-java/pull/6944,6970,https://github.com/open-telemetry/opentelemetry-java/issues/6970,763,Good PR,"The issue describes specific, actionable problems related to dependency management and artifact stability, with detailed examples and proposed solutions. It does not involve reverting changes, is not vague, and focuses on single well-defined issues. Additionally, most of the content is in English and provides enough context for a developer to start working on the solution."
6984,https://github.com/open-telemetry/opentelemetry-java/pull/6984,6975,https://github.com/open-telemetry/opentelemetry-java/issues/6975,144,Good PR,"The issue describes a specific problem with the design of the Authenticator in the system, providing a clear and actionable problem to address. It isn't a revert or a vague request, focuses on a distinct issue, and is primarily written in English. The analysis provides enough context for developers to understand the problem and start working on a solution."
